{
  "General": {
    "GlobalTimeout": 7200,
    "RecreateStagingTable": false,
    "ForceFullSync": false,
    "RecreateStoredProcedure": false,
    "NumberOfThreads": 4,
    "RunSanityCheck": true,
    "FailOnSanityError": true,
    "MaxRetries": 3,
    "RetryDelaySeconds": 10,
    "DeleteLogOlderThanDays": 30,
    "CleanupOrphans": false,
    "OrphanCleanupBatchSize": 50000,
    "IdColumn": "ID",
    "TimestampColumns": ["GESPEICHERT", "MODIFIED_DATE", "LAST_UPDATE", "CHANGED_AT"]
  },
  "Firebird": {
    "Server": "DEIN_SERVER_NAME",
    "Password": "DEIN_PASSWORT",
    "Database": "C:\\Pfad\\Zu\\Deiner\\Datenbank.FDB",
    "Port": 3050,
    "Charset": "UTF8",
    "DllPath": "C:\\Pfad\\Zur\\FirebirdSql.Data.FirebirdClient.dll"
  },
  "MSSQL": {
    "Server": "SQLSERVER01",
    "Integrated Security": true,
    "Username": "DEIN_BENUTZER",
    "Password": "DEIN_PASSWORT",
    "Database": "STAGING",
    "Prefix": "FB_",
    "Suffix": "",
    "Port": 1433
  },
  "Tables": [
    "BLIEF", 
    "BKUNDE", 
    "BSA",
    "LEGACY_ORDERS",
    "AUDIT_LOG"
  ],
  "TableOverrides": {
    "LEGACY_ORDERS": {
      "IdColumn": "ORDER_ID",
      "TimestampColumn": "CHANGED_AT"
    },
    "AUDIT_LOG": {
      "IdColumn": "LOG_ID"
    }
  }
}
